id	author	date	target_text	comment_text	reply_comments	status
1	岡本 裕一朗	2026-02-04T13:06:00Z	し合う	ヘーゲルでは、相互承認は目的とされましたが、現実的には「一方的な承認」しか成り立っていません。その代表例が、主人と奴隷の関係です。ただ、このほうが現実の社会には、近いかもしれません。この点、どう盛り込むか？		
2	岡本 裕一朗	2026-02-04T13:22:00Z	こと	「褒めない＝鏡を差しださない」となるだろうか？褒めないこと自体が、それ自身その人への評価にもなる。したがって、単純な等式は控える必要があるのでは？		
3	岡本 裕一朗	2026-02-04T13:26:00Z	「きつい文化」	日本の文化が、集団志向的で、個人への規律が厳しいのは、昔から指摘されています。これを、ゲルファンドのような理論だけで説明するのは、やや疑問が残ります。タイトな文化には、歴史的に脅威が多い、とされますが、見方を変えると日本は島国で、外的は少ないとも言えます。要するには、災害、疫病、外的などは、何を基準とするかで変わりそうです。		
4	岡本 裕一朗	2026-02-04T13:28:00Z	他者には「鏡」を、自分には「役割」を	ここでは、「鏡」と「任務」が対立的に捉えられていますが、考えを変えると、「任務」は「鏡」の一つとも言えます。そもそも、何を鏡とするか、少し定義する必要がありそうです。		
7	岡本 裕一朗	2026-02-04T13:31:00Z	ゲルファンド	ミシェル・ゲルファンド（Michele Gelfand）らによって提唱された「タイト・ルーズ理論（Tight-Loose Theory）」 が必要では？		
